A writing workshop enrolls novelists and poets in a ratio of [a] to [b] . There are [c] people at the workshop . How many novelists are there ? How many poets are there ?	[b]*VAR_0=[a]*VAR_1,VAR_0+VAR_1=[c]	{'[a]': '5.0', '[b]': '3.0', '[c]': '24.0'}	[15.0,9.0]
You are selling tickets for a high school play . Student tickets cost [a] dollars and general admission tickets cost [b] dollars . You sell [c] tickets and collect [d] dollars . How many student tickets and general admission tickets did you sell ?	([a]*VAR_1)+([b]*VAR_0)=[d],VAR_1+VAR_0=[c]	{'[d]': '2876.0', '[a]': '4.0', '[b]': '6.0', '[c]': '525.0'}	[137.0,388.0]
A store is selling compact discs for [a] dollars and [b] dollars . You buy [c] discs and spend a total of [d] dollars . How many compact discs did you buy that cost [a] dollars ? How many did you buy that cost [b] dollars ?	([a]*VAR_1)+([b]*VAR_0)=[d],VAR_1+VAR_0=[c]	{'[d]': '93.0', '[a]': '10.5', '[b]': '8.5', '[c]': '10.0'}	[4.0,6.0]
For his long distance phone service Milan pays a [a] dollars monthly fee plus [b] cents per minute . Last month , Milan 's long distance bill was [c] dollars . For how many minutes was Milan billed for ?	[a]+(([b]*0.01)*VAR_0)=[c]	{'[a]': '2.0', '[b]': '12.0', '[c]': '23.36'}	[178.0]
The sum of [a] numbers is [b] . The first number is [c] less than twice the second number . Find the smaller number . Find the larger number.	([a]*VAR_0)-VAR_1=[c],VAR_1+VAR_0=[b]	{'[a]': '2.0', '[b]': '50.0', '[c]': '43.0'}	[19.0,31.0]
The Kings won two less than three times as many games as they lost . They played [a] games . How many wins and losses did the team have ?	VAR_1+VAR_0=[a],VAR_1=(3.0*VAR_0)-2.0	{'[a]': '82.0'}	[61.0,21.0]
The Booster Club voted on where they would go for their annual trip . A majority of the club voted to go to a baseball game . They bought [a] tickets . Some of the tickets cost [b] dollars per ticket and some cost [c] dollars per ticket . All of the tickets cost [d] dollars . How many 7-dollar tickets did they buy ? How many 9-dollar tickets did they buy ?	([b]*VAR_1)+([c]*VAR_0)=[d],VAR_1+VAR_0=[a]	{'[d]': '225.0', '[a]': '29.0', '[b]': '7.0', '[c]': '9.0'}	[18.0,11.0]
Find [a] numbers whose sum is [b] and whose difference is [c] . What is the smaller number ? What is the larger number ?	VAR_0+VAR_1=[b],VAR_0-VAR_1=[c]	{'[a]': '2.0', '[b]': '64.0', '[c]': '4.0'}	[30.0,34.0]
A student is pricing [a] different picture packages . John 's Photo World charges [b] dollars per sheet and a one time sitting fee of [c] dollars . Sam 's Picture Emporium charges [d] dollars per sheet and a one time sitting fee of [e] dollars . For how many sheets of pictures do the [a] companies charge the same amount ?	([b]*VAR_0)+[c]=([d]*VAR_0)+[e]	{'[d]': '1.5', '[a]': '2.0', '[e]': '140.0', '[b]': '2.75', '[c]': '125.0'}	[12.0]
A car rented for [a] dollars per day plus [b] dollars per mile . Julia paid [c] dollars for a 1-day rental . How far did she drive , in miles ?	[a]+([b]*VAR_0)=[c]	{'[a]': '29.0', '[b]': '0.08', '[c]': '46.12'}	[214.0]
Red cards are worth [a] credits , while blue cards are worth [b] credits . You need any combination of [c] cards to play a game . With [d] credits to buy cards , how many blue cards will you have when you play ? how many red cards will you have when you play ?	([b]*VAR_0)+([a]*VAR_1)=[d],VAR_0+VAR_1=[c]	{'[d]': '84.0', '[a]': '3.0', '[b]': '5.0', '[c]': '20.0'}	[12.0,8.0]
Walt made an extra [a] dollars last year from a part-time job . He invested part of the money at [b] % and the rest at [c] % . He made a total of [d] dollars in interest . How much was invested at [c] % ?	(([b]*0.01)*VAR_1)+(([c]*0.01)*VAR_0)=[d],VAR_1+VAR_0=[a]	{'[d]': '770.0', '[a]': '9000.0', '[b]': '9.0', '[c]': '8.0'}	[4000.0]
Tony planted a [a] foot tree . The tree grows at a rate of [b] feet every year . How many years will it take to be [c] feet ?	[a]+([b]*VAR_0)=[c]	{'[a]': '4.0', '[b]': '5.0', '[c]': '29.0'}	[5.0]
Safety Rent A Truck costs [a] dollars plus [b] dollars per mile . City Rentals rents the truck for [c] dollars plus [d] dollars per mile . For what mileage are the costs the same ?	[a]+([b]*VAR_0)=[c]+([d]*VAR_0)	{'[d]': '0.31', '[a]': '41.95', '[b]': '0.29', '[c]': '38.95'}	[150.0]
In college there are [a] times as many students as professors . If together the students and professors number [b] , how many students are there in college ?	[a]*VAR_0=VAR_1,VAR_1+VAR_0=[b]	{'[a]': '15.0', '[b]': '40000.0'}	[37500.0]
A washer and a dryer cost [a] dollars combined . The price of the washer is [b] times the price of the dryer . What is the cost of the dryer ?	VAR_1+VAR_0=[a],VAR_1=[b]*VAR_0	{'[a]': '600.0', '[b]': '3.0'}	[150.0]
Tickets for a ballet performance cost [a] dollars for adults and [b] dollars for students . If total receipts from the sale of [c] tickets were [d] dollars , how many adult tickets were sold ? How many student tickets were sold ?	([a]*VAR_0)+([b]*VAR_1)=[d],VAR_0+VAR_1=[c]	{'[d]': '8390.0', '[a]': '14.0', '[b]': '12.0', '[c]': '605.0'}	[565.0,40.0]
Apples cost [a] dollars per pound and grapes cost [b] dollars per pound . Jenny bought [c] pounds of fruit and paid [d] dollars . How many pounds of apples did she buy ? How many pounds of grapes ?	([a]*VAR_0)+([b]*VAR_1)=[d],VAR_0+VAR_1=[c]	{'[d]': '10.0', '[a]': '0.6', '[b]': '1.0', '[c]': '12.0'}	[5.0,7.0]
Three times a number is the same as the difference of twice the number and seven . Find the number.	3.0*VAR_0=(2.0*VAR_0)-7.0	{}	[-7.0]
The sum of [a] and a number is [b] .	[a]+VAR_0=[b]	{'[a]': '20.0', '[b]': '30.0'}	[10.0]
An amusement park sells [a] kinds of tickets . Tickets for children cost [b] dollars . Adult tickets cost [c] dollars . On a certain day , [d] people entered the park . On that same day the admission fees collected totaled [e] dollars . How many children were admitted on that day ? How many adults were admitted ?	([b]*VAR_1)+([c]*VAR_0)=[e],VAR_1+VAR_0=[d]	{'[d]': '278.0', '[a]': '2.0', '[e]': '792.0', '[b]': '1.5', '[c]': '4.0'}	[128.0,150.0]
Jane has a dress shop . She has space for [a] dresses . She sells only red and blue dresses . After reading several fashion magazines she decides to stock her shelves with [b] more blue dresses than red dresses . How many blue dresses and red dresses should she stock ?	VAR_0=[b]+VAR_1,VAR_0+VAR_1=[a]	{'[a]': '200.0', '[b]': '34.0'}	[117.0,83.0]
A company 's profit for the first half of the year is [a] dollars greater than the profit for the second half . If the total annual profit is [b] dollars , find the profit for the first half-year and the second half-year .	VAR_0+VAR_1=[b],VAR_0=[a]+VAR_1	{'[a]': '2750000.0', '[b]': '3635000.0'}	[3192500.0,442500.0]
Pat invested a total of [a] dollars . Part of the money yields [b] percent interest per year and the rest yields [c] percent interest per year . If the total yearly interest from this investment is [d] dollars , how much did Pat invest at [b] percent and how much at [c] percent ?	(([c]*0.01)*VAR_1)+(([b]*0.01)*VAR_0)=[d],VAR_1+VAR_0=[a]	{'[d]': '256.0', '[a]': '3000.0', '[b]': '10.0', '[c]': '8.0'}	[800.0,2200.0]
The state market has [a] more apples than oranges . There are [b] apples and oranges all together . How many apples are in the market ?	VAR_0+VAR_1=[b],VAR_0=[a]+VAR_1	{'[a]': '27.0', '[b]': '301.0'}	[164.0]
The tallest player on the basketball team is [a] inches tall . This is [b] inches taller than the shortest player . How tall is the shortest player , in inches ?	VAR_0=[a]-[b]	{'[a]': '77.75', '[b]': '9.5'}	[68.25]
Riza was [a] when her first son was born . Today the sum of their ages is [b] . How old is Riza and her son now ?	VAR_0+VAR_1=[b],VAR_0=[a]+VAR_1	{'[a]': '25.0', '[b]': '105.0'}	[65.0,40.0]
You have [a] total items that consist of hats and boots . The total cost is [b] dollars . Boots cost [c] dollars and hats cost [d] dollars . How many boots are there ? How many hats ?	([c]*VAR_0)+([d]*VAR_1)=[b],VAR_1+VAR_0=[a]	{'[d]': '5.0', '[a]': '30.0', '[b]': '190.0', '[c]': '9.0'}	[10.0,20.0]
A [a] ounce can of cranberry juice sells for [b] cents . Give the unit cost in cents per ounce.	VAR_0=[b]/[a]	{'[a]': '12.0', '[b]': '84.0'}	[7.0]
Safety Rent-a-Car rents an intermediate-size car at a daily rate of [a] dollars plus [b] per mile . City Rentals rent an intermediate-size car for [c] dollars plus [d] per mile . For what milage is the cost the same ?	[a]+([b]*VAR_0)=[c]+([d]*VAR_0)	{'[d]': '0.21', '[a]': '21.95', '[b]': '0.19', '[c]': '18.95'}	[150.0]
In a basketball game , Will scored [a] points , consisting only of 3-point shots and 2-point shots . He made a total of [b] shots . How many 3-point shots did he make ? How many 2-point shots did he make ?	(3.0*VAR_0)+(2.0*VAR_1)=[a],VAR_0+VAR_1=[b]	{'[a]': '26.0', '[b]': '11.0'}	[4.0,7.0]
One number is [a] more than twice a second number . Their sum is [b] . Find the smaller number . Find the larger number.	VAR_0+VAR_1=[b],VAR_0=(2.0*VAR_1)+[a]	{'[a]': '3.0', '[b]': '27.0'}	[8.0,19.0]
Lakota bought [a] new compact disks and [b] used compact disks for [c] dollars . At the same prices , Mackenzie bought [d] new compact disks and [e] used compact disks for [f] dollars . Find the cost of buying a single used compact disk .	([a]*VAR_0)+([b]*VAR_1)=[c],([d]*VAR_0)+([e]*VAR_1)=[f]	{'[d]': '3.0', '[a]': '6.0', '[f]': '133.89', '[e]': '8.0', '[b]': '2.0', '[c]': '127.92'}	[9.99]
Manuel opened a savings account with an initial deposit of [a] dollars . If he wants to save [b] dollars during the next [c] weeks , how much must he save each week , in dollars ?	[a]+([c]*VAR_0)=[b]	{'[a]': '177.0', '[b]': '500.0', '[c]': '19.0'}	[17.0]
Tickets for a concert were priced at [a] dollars for students and [b] dollars for non-students . There were [c] tickets sold for a total of [d] dollars . How many student tickets were sold ? How many non-student tickets ?	([a]*VAR_1)+([b]*VAR_0)=[d],VAR_1+VAR_0=[c]	{'[d]': '17339.0', '[a]': '7.0', '[b]': '10.0', '[c]': '2000.0'}	[887.0,1113.0]
A math test is worth [a] points and has [b] problems . Each problem is worth either [c] points or [d] points . How many [d] point problems are there ?	([c]*VAR_1)+([d]*VAR_0)=[a],VAR_1+VAR_0=[b]	{'[d]': '4.0', '[a]': '100.0', '[b]': '30.0', '[c]': '3.0'}	[10.0]
Two investments earn an annual income of [a] dollars . One investment earns an annual simple interest rate of [b] % , and the other investment earns an annual simple interest rate of [c] % . The amount invested is [d] dollars . How much money is invested in the first investment and second investment respectively ?	([b]*.01*VAR_0)+([c]*.01*VAR_1)=[a],VAR_0+VAR_1=[d]	{'[d]': '8000.0', '[a]': '575.0', '[b]': '8.5', '[c]': '6.4'}	[3000.0,5000.0]
Norbert sold [a] books on Thursday for a certain price . On Friday , he sold [b] of the same books , but he charged [c] dollars less per book . He made [d] dollars in total . How much did the book sell for on Thursday ? How much did the book sell for on Friday ?	([a]*VAR_1)+([b]*VAR_0)=[d],VAR_1-[c]=VAR_0	{'[d]': '490.0', '[a]': '23.0', '[b]': '35.0', '[c]': '0.5'}	[8.75,8.25]
You buy [a] boxes of candy and spend [b] dollars . A box of peppermint cost [c] dollars a box and candy canes cost [d] dollars a box . How many boxes of peppermint did you buy ? How many boxes of candy canes ?	([c]*VAR_1)+([d]*VAR_0)=[b],VAR_1+VAR_0=[a]	{'[d]': '1.3', '[a]': '25.0', '[b]': '28.0', '[c]': '1.0'}	[15.0,10.0]
A dealer has some hard candy worth [a] dollars a pound and some worth [b] dollars a pound . He wishes to make a mixture of [c] pounds that he can sell for [d] dollars a pound . How many pounds of 2-dollar candy does he need ? How many pounds of 3-dollar candy does he need ?	([a]*VAR_1)+([b]*VAR_0)=[c]*[d],VAR_1+VAR_0=[c]	{'[d]': '2.2', '[a]': '2.0', '[b]': '3.0', '[c]': '80.0'}	[64.0,16.0]
A plane flies [a] miles with a tail wind in [b] hours . The same plane takes [c] hours to make the return trip against the wind . What is the speed of the plane in still air ?	(VAR_0+VAR_1)*[b]=[a],(VAR_0-VAR_1)*[c]=[a]	{'[a]': '900.0', '[b]': '3.0', '[c]': '4.0'}	[262.5]
Two rainstorms occurred in one week in a certain area . In the first storm [a] milliliters of rain fell per hour , and in the second storm [b] milliliters of rain fell per hour . Rain fell that week for a total of [c] hours , for a total rainfall of [d] milliliters . How many hours was the first storm and the second storm .	([a]*VAR_1)+([b]*VAR_0)=[d],VAR_1+VAR_0=[c]	{'[d]': '975.0', '[a]': '30.0', '[b]': '15.0', '[c]': '45.0'}	[20.0,25.0]
On a test containing [a] questions , the final score is based on [b] point for each correct answer and [c] of a point subtracted for each incorrect answer . Allan answered all of the questions and received a final score of [d] points . How many questions did Allan answer correctly ?	([b]*VAR_0)-([c]*VAR_1)=[d],VAR_0+VAR_1=[a]	{'[d]': '100.0', '[a]': '120.0', '[b]': '1.0', '[c]': '0.25'}	[104.0]
A cashier at Apex Parts received a check for [a] dollars for [b] parts . Some parts cost [c] dollars per part and other parts cost [d] dollars per part . How many 20-dollar parts are in the order ? How many 50-dollar parts are in the order ?	([c]*VAR_1)+([d]*VAR_0)=[a],VAR_1+VAR_0=[b]	{'[d]': '50.0', '[a]': '2380.0', '[b]': '59.0', '[c]': '20.0'}	[19.0,40.0]
A chemist has one solution that is [a] % acid and a second that is [b] % acid . How many liters of each should be mixed together to get [c] liters that is [d] % acid ?	(([a]*0.01)*VAR_0)+(([b]*0.01)*VAR_1)=[d]*0.01*[c],VAR_0+VAR_1=[c]	{'[d]': '18.0', '[a]': '15.0', '[b]': '25.0', '[c]': '100.0'}	[70.0,30.0]
One number exceeds another by [a] and their sum is [b] . Find the larger number.	VAR_0+VAR_1=[b],VAR_0=[a]+VAR_1	{'[a]': '10.0', '[b]': '34.0'}	[22.0]
A chemistry lab can be used by [a] students at one time . The lab has [b] work-stations . Some set up for [c] students and the others set up for [d] students . How many work-stations accommodate [c] students ?	([c]*VAR_1)+([d]*VAR_0)=[a],VAR_1+VAR_0=[b]	{'[d]': '3.0', '[a]': '38.0', '[b]': '16.0', '[c]': '2.0'}	[10.0]
A jazz concert brought in [a] dollars with the sale of [b] tickets . If tickets were sold for [c] dollars and [d] dollars each , how many 20-dollar tickets were sold ? How many 30-dollar tickets ?	([c]*VAR_1)+([d]*VAR_0)=[a],VAR_1+VAR_0=[b]	{'[d]': '30.0', '[a]': '191000.0', '[b]': '7400.0', '[c]': '20.0'}	[3100.0,4300.0]
A truck and trailer together weigh [a] pounds . The trailer weighs [b] pounds less than [c] as much as the truck . Find the truck 's weight . Find the trailer 's weight .	VAR_1+VAR_0=[a],VAR_0=([c]*VAR_1)-[b]	{'[a]': '7000.0', '[b]': '200.0', '[c]': '0.5'}	[4800.0,2200.0]
A farmhouse has [a] animals . Some are goats and some are ducks . Altogether there are [b] legs . How many of each animal are there ?	(4.0*VAR_1)+(2.0*VAR_0)=[b],VAR_1+VAR_0=[a]	{'[a]': '15.0', '[b]': '48.0'}	[9.0,6.0]
A cashier has a total of [a] bills , made up of 5-dollar bills and 10-dollar bills . The total value of the money is [b] dollars . How many 5-dollar bills does he have ? How many 10-dollar bills ?	(5.0*VAR_0)+(10.0*VAR_1)=[b],VAR_0+VAR_1=[a]	{'[a]': '126.0', '[b]': '840.0'}	[84.0,42.0]
Peter sold pumpkins from his farm . He sold jumbo pumpkins for [a] dollars each , and he sold regular pumpkins for [b] dollars each . Peter sold [c] pumpkins and collected [d] dollars . How many jumbo pumpkins and regular pumpkins did he sell ?	([a]*VAR_0)+([b]*VAR_1)=[d],VAR_0+VAR_1=[c]	{'[d]': '395.0', '[a]': '9.0', '[b]': '4.0', '[c]': '80.0'}	[15.0,65.0]
An airplane has a total of [a] seats . The number of coach class seats is [b] more than [c] times the number of first-class seats . How many first class and coach class seats are there on the plane ?	VAR_0+VAR_1=[a],VAR_0=([c]*VAR_1)+[b]	{'[a]': '387.0', '[b]': '2.0', '[c]': '4.0'}	[77.0,310.0]
A grocer bought [a] bushels of Baldwin and McInotosh apples . Baldwins costs [b] cents a bushel , but McIntosh cost only [c] cents a bushel . If he paid [d] dollars for the lot , how many bushels of Baldwins did he get ? How many bushels of McIntosh ?	([b]*.01*VAR_0)+([c]*.01*VAR_1)=[d],VAR_0+VAR_1=[a]	{'[d]': '11.0', '[a]': '12.0', '[b]': '95.0', '[c]': '90.0'}	[4.0,8.0]
At a movie theater , tickets cost [a] dollars for adults and [b] dollars for children . A group of [c] moviegoers pays a total of [d] dollars . How many adults and children were in the group ?	([a]*VAR_0)+([b]*VAR_1)=[d],VAR_0+VAR_1=[c]	{'[d]': '54.5', '[a]': '9.5', '[b]': '6.5', '[c]': '7.0'}	[3.0,4.0]
There are [a] kids in Mrs Jones ' class . There are twice as many girls as boys . How many boys and girls are there ?	VAR_0+VAR_1=[a],VAR_1=2.0*VAR_0	{'[a]': '24.0'}	[8.0,16.0]
Max bought [a] pounds of nuts at a party . The total cost was [b] dollars . The peanuts cost [c] dollars per pound and the almounds cost [d] dollars per pound . How many pounds of peanuts did max buy ? How many pounds of almounds did Max buy ?	([c]*VAR_1)+([d]*VAR_0)=[b],VAR_1+VAR_0=[a]	{'[d]': '5.0', '[a]': '16.0', '[b]': '72.0', '[c]': '3.0'}	[4.0,12.0]
The second number is [a] less than twice the first number . Their sum is [b] . Find the second number.	VAR_1=(2.0*VAR_0)-[a],VAR_0+VAR_1=[b]	{'[a]': '3.0', '[b]': '57.0'}	[37.0]
For his long distance phone calls , John pays a [a] dollars monthly fee plus [b] cents per minute . Last month , John 's long distance bill was [c] dollars . For how many minutes was John billed ?	[a]+(([b]*0.01)*VAR_0)=[c]	{'[a]': '5.0', '[b]': '25.0', '[c]': '12.02'}	[28.08]
During a sale an automobile dealer sold [a] cars and trucks . If she sold [b] more cars than trucks how many trucks did she sell ?	VAR_0+VAR_1=[a],VAR_1=VAR_0-[b]	{'[a]': '69.0', '[b]': '27.0'}	[21.0]
The second of two numbers is [a] more than the first . The sum is [b] . Find the first and second numbers .	[a]+VAR_0=VAR_1,VAR_1+VAR_0=[b]	{'[a]': '4.0', '[b]': '56.0'}	[26.0,30.0]
Lane invested [a] dollars , part at [b] % and part at [c] % . If the total interest at the end of the year is [d] dollars , how much did she invest at [b] % ?	(([b]*0.01)*VAR_0)+(([c]*0.01)*VAR_1)=[d],VAR_0+VAR_1=[a]	{'[d]': '1710.0', '[a]': '22000.0', '[b]': '8.0', '[c]': '7.0'}	[17000.0]
High school graduating class is made up of [a] students . There are [b] more girls than boys . How many boys are in the class ?	[b]+VAR_0=VAR_1,VAR_1+VAR_0=[a]	{'[a]': '466.0', '[b]': '212.0'}	[127.0]
When [a] times the number is added to [b] times the number the result is [c] . What is the number ?	([a]*VAR_0)+([b]*VAR_0)=[c]	{'[a]': '4.0', '[b]': '7.0', '[c]': '55.0'}	[5.0]
The owner of the Most Amazing Circus was counting the money from one day 's ticket sales . He knew that a total of [a] tickets were sold . Adult tickets cost [b] dollars each and children 's tickets cost [c] dollars each . If the total receipts for the day were [d] dollars , how many adult tickets were sold ? How many children 's tickets ?	([b]*VAR_0)+([c]*VAR_1)=[d],VAR_0+VAR_1=[a]	{'[d]': '5086.0', '[a]': '522.0', '[b]': '15.0', '[c]': '8.0'}	[130.0,392.0]
There are [a] douglas fir and ponderosa pine trees in a section of the forest bought by Sawz logging company . The company paid an average of [b] dollars for each douglas fir and [c] dollars for each ponderosa pine . if the company paid [d] dollars for the trees , how many firs and pines did they buy ?	([b]*VAR_0)+([c]*VAR_1)=[d],VAR_0+VAR_1=[a]	{'[d]': '217500.0', '[a]': '850.0', '[b]': '300.0', '[c]': '250.0'}	[100.0,750.0]
A plumber contractor decides to field-test two new pumps . One is rated at [a] gallons per hour and the other at [b] gallons per hour . Over a period of [c] hours , she pumps a total of [d] gallons . How many hours were used by the [a] gallons per hour pump ? How many hours were used by the [b] gallons per hour pump ?	([a]*VAR_0)+([b]*VAR_1)=[d],VAR_0+VAR_1=[c]	{'[d]': '1325.0', '[a]': '180.0', '[b]': '250.0', '[c]': '6.0'}	[2.5,3.5]
A woman invested a total of [a] dollars in [b] accounts , one earning [c] % annual interest and the other earning [d] % annual interest . After [e] year , her combined interest was [f] dollars . How much did she invest in the account paying [d] % interest , in dollars ?	(([c]*0.01)*VAR_1)+(([d]*0.01)*VAR_0)=[f],VAR_1+VAR_0=[a]	{'[d]': '8.0', '[a]': '9000.0', '[f]': '678.87', '[e]': '1.0', '[b]': '2.0', '[c]': '6.5'}	[6258.0]
Rita received a [a] dollars gift card for a coffee store . She used it in buying some coffee that cost [b] dollars per pound . After buying the coffee , she had [c] dollars left on her card . How many pounds of coffee did she buy ?	[a]-([b]*VAR_0)=[c]	{'[a]': '70.0', '[b]': '8.58', '[c]': '35.68'}	[4.0]
The sum of two numbers is [a] , and their difference is [b] . What are the numbers ?	VAR_0+VAR_1=[a],VAR_0-VAR_1=[b]	{'[a]': '52.0', '[b]': '6.0'}	[29.0,23.0]
According to Dr . Aaron R . Folsom of the University of Minnesota School of Public Health , your maximum ideal waist size is directly proportional to your hip size . For a woman with [a] inch hips , the maximum ideal waist size is [b] inches . What is the maximum waist size for a woman with [c] inch hips ?	[a]*VAR_1=[b],[c]*VAR_1=VAR_0	{'[a]': '40.0', '[b]': '32.0', '[c]': '35.0'}	[28.0]
Tennis rackets can be packaged in cartons holding [a] rackets each or in cartons holding [b] rackets each . Yesterday 's packing slip showed that [c] cartons were used to pack a total of [d] rackets . How many cartons of [a] rackets size were used yesterday ? How many cartons of [b] rackets size were used yesterday ?	([a]*VAR_1)+([b]*VAR_0)=[d],VAR_1+VAR_0=[c]	{'[d]': '100.0', '[a]': '2.0', '[b]': '3.0', '[c]': '38.0'}	[14.0,24.0]
Three times a number minus a second number is [a] . The sum of the two numbers is [b] . Find the two numbers.	(3.0*VAR_0)-VAR_1=[a],VAR_0+VAR_1=[b]	{'[a]': '20.0', '[b]': '48.0'}	[17.0,31.0]
The sum of [a] numbers is [b] . The second is [c] more than [d] times the first . Find the smaller number . Find the larger number.	VAR_1+VAR_0=[b],VAR_0=[c]+([d]*VAR_1)	{'[d]': '3.0', '[a]': '2.0', '[b]': '70.0', '[c]': '10.0'}	[15.0,55.0]
A boat travels [a] miles upstream in [b] hours . The boat travels the same distance downstream in [c] hours . What is the speed of the boat in still water in miles per hour ? What is the speed of the current in miles per hour ?	(VAR_0+VAR_1)*[c]=[a],(VAR_0-VAR_1)*[b]=[a]	{'[a]': '45.0', '[b]': '5.0', '[c]': '3.0'}	[12.0,3.0]
Soft drinks are on sale at the grocery store for [a] dollars for a [b] pack . How much would each can of soft drink cost if purchased individually , in dollars ?	VAR_0=[a]/[b]	{'[a]': '2.99', '[b]': '12.0'}	[0.25]
A chemist has a solution that is [a] % alcohol and one that is [b] % alcohol . He wants to make [c] liters of a [d] % solution . How many liters of the [a] % solution should he add ? How many liters of the [d] % solution should he add ?	([a]*.01*VAR_0)+([b]*.01*VAR_1)=[d]*0.01*[c],VAR_0+VAR_1=[c]	{'[d]': '30.0', '[a]': '18.0', '[b]': '50.0', '[c]': '80.0'}	[50.0,30.0]
If the product of [a] and a number is increased by [b] , the result is [c] . What is the number ?	([a]*VAR_0)+[b]=[c]	{'[a]': '5.0', '[b]': '4.0', '[c]': '19.0'}	[3.0]
Your teacher is giving you a test worth [a] points containing [b] questions . There are 2-point and 4-point questions on the test . How many questions are worth two points ? How many questions are worth four points ?	(2.0*VAR_1)+(4.0*VAR_0)=[a],VAR_1+VAR_0=[b]	{'[a]': '100.0', '[b]': '40.0'}	[30.0,10.0]
[a] pencils and [b] pens cost a total of [c] dollars . [d] pencils and [a] pens cost [e] dollars . Find the cost of a pencil and a pen in dollars.	([a]*VAR_1)+([b]*VAR_0)=[c],([d]*VAR_1)+([a]*VAR_0)=[e]	{'[d]': '3.0', '[a]': '4.0', '[e]': '1.58', '[b]': '5.0', '[c]': '2.0'}	[0.1,0.32]
Marc sold [a] tickets for the school play . Student tickets cost [b] dollars and adult tickets cost [c] dollars . Marc 's sales totaled [d] dollars . How many adult tickets and student tickets did Marc sell ?	([c]*VAR_0)+([b]*VAR_1)=[d],VAR_0+VAR_1=[a]	{'[d]': '2840.0', '[a]': '563.0', '[b]': '4.0', '[c]': '6.0'}	[294.0,269.0]
The sum of two numbers is [a] and the difference is [b] . Find the two numbers.	VAR_0+VAR_1=[a],VAR_0-VAR_1=[b]	{'[a]': '32.0', '[b]': '14.0'}	[23.0,9.0]
Two rainstorms occurred in one week in a certain area . The first storm lasted [a] hours , and the second storm lasted [b] hours , for a total [c] milliliters of rain . What was the rate of rainfall in milliliters per hour for the first and second storms if the sum of the two rates was [d] milliliters per hour ?	([a]*VAR_0)+([b]*VAR_1)=[c],VAR_0+VAR_1=[d]	{'[d]': '55.0', '[a]': '20.0', '[b]': '40.0', '[c]': '1800.0'}	[20.0,35.0]
Tickets for a show cost [a] dollars for adults and [b] dollars for children . [c] tickets were sold for a total of [d] dollars . How many adult tickets and how many childrens tickets were sold ?	([a]*VAR_0)+([b]*VAR_1)=[d],VAR_0+VAR_1=[c]	{'[d]': '2100.0', '[a]': '6.0', '[b]': '4.5', '[c]': '400.0'}	[200.0,200.0]
The grocer has peanuts for [a] dollars a pound and walnuts for [b] dollars a pound . How many pounds of peanuts and walnuts must we mix to get [c] pounds of mixture to sell for [d] dollars per pound .	([a]*VAR_0)+([b]*VAR_1)=[d]*[c],VAR_0+VAR_1=[c]	{'[d]': '3.0', '[a]': '3.75', '[b]': '2.75', '[c]': '40.0'}	[10.0,30.0]
The shoe store has twice as many black shoes as it does brown shoes . The total number of shoes is [a] . How many brown shoes are there ?	VAR_0=2.0*VAR_1,VAR_1+VAR_0=[a]	{'[a]': '66.0'}	[22.0]
The sum of [a] numbers is [b] . If three times the smaller number is subtracted from the larger number , the result is [c] . Find the two numbers .	VAR_1+VAR_0=[b],VAR_0-(3.0*VAR_1)=[c]	{'[a]': '2.0', '[b]': '138.0', '[c]': '22.0'}	[29.0,109.0]
Latoya purchased a prepaid phone card for [a] dollars . Long distance calls cost [b] cents a minute using this card . Latoya used her card only once to make a long distance call . If the remaining credit on her card is [c] dollars , how many minutes did her call last ?	[b]*.01*VAR_0=[a]-[c]	{'[a]': '30.0', '[b]': '16.0', '[c]': '26.48'}	[22.0]
