Marc sold [a] tickets for the school play . Student tickets cost [b] dollars and adult tickets cost [c] dollars . Marc 's sales totaled [d] dollars . How many adult tickets and student tickets did Marc sell ?	([c]*VAR_0)+([b]*VAR_1)=[d],VAR_0+VAR_1=[a]	{'[d]': '2840.0', '[a]': '563.0', '[b]': '4.0', '[c]': '6.0'}	[294.0,269.0]
The grocer has peanuts for [a] dollars a pound and walnuts for [b] dollars a pound . How many pounds of peanuts and walnuts must we mix to get [c] pounds of mixture to sell for [d] dollars per pound .	([a]*VAR_0)+([b]*VAR_1)=[d]*[c],VAR_0+VAR_1=[c]	{'[d]': '3.0', '[a]': '3.75', '[b]': '2.75', '[c]': '40.0'}	[10.0,30.0]
The shoe store has twice as many black shoes as it does brown shoes . The total number of shoes is [a] . How many brown shoes are there ?	VAR_0=2.0*VAR_1,VAR_1+VAR_0=[a]	{'[a]': '66.0'}	[22.0]
The sum of [a] numbers is [b] . If three times the smaller number is subtracted from the larger number , the result is [c] . Find the two numbers .	VAR_1+VAR_0=[b],VAR_0-(3.0*VAR_1)=[c]	{'[a]': '2.0', '[b]': '138.0', '[c]': '22.0'}	[29.0,109.0]
Latoya purchased a prepaid phone card for [a] dollars . Long distance calls cost [b] cents a minute using this card . Latoya used her card only once to make a long distance call . If the remaining credit on her card is [c] dollars , how many minutes did her call last ?	[b]*.01*VAR_0=[a]-[c]	{'[a]': '30.0', '[b]': '16.0', '[c]': '26.48'}	[22.0]
David bought [a] hamburgers and [b] servings of french fries at Diane 's Drive Up for [c] dollars . If a serving of fries costs [d] cents more then a hamburger , what is the cost of a hamburger and what is the cost of a serving of french fries ?	([a]*VAR_1)+([b]*VAR_0)=[c],VAR_0=[d]+VAR_1	{'[d]': '0.25', '[a]': '3.0', '[b]': '2.0', '[c]': '6.25'}	[1.15,1.4]
Yuri has a board that [a] inches long . He wishes to cut the board into [b] pieces so that one piece will be [c] inches longer than the other . What should the length of the shorter piece be , in inches ? What will the length of the longer piece be ?	VAR_0+VAR_1=[a],VAR_0=[c]+VAR_1	{'[a]': '98.0', '[b]': '2.0', '[c]': '10.0'}	[44.0,54.0]
A person wishes to invest [a] dollars , part at [b] % and part at [c] % . If the total interest desired at the end of the year is [d] dollars , how much should be invested at each rate ?	(([c]*0.01)*VAR_1)+(([b]*0.01)*VAR_0)=[d],VAR_1+VAR_0=[a]	{'[d]': '189.0', '[a]': '2400.0', '[b]': '9.0', '[c]': '6.0'}	[1500.0,900.0]
A baseball player has a batting average of [a] with [b] hits in [c] bats . His average against left-handed pitching is [d] . Against right-handed pitching it is [e] . How many times did he bat against left-handers ?	([d]*VAR_0)+([e]*VAR_1)=[b],VAR_0+VAR_1=[c]	{'[d]': '0.25', '[a]': '0.32', '[e]': '0.35', '[b]': '192.0', '[c]': '600.0'}	[180.0]
Tickets for a play at the community theater cost [a] dollars for an adult and [b] dollars for a child . If [c] tickets were sold and the total receipts were [d] dollars , how many adult tickets and child tickets were sold ?	([a]*VAR_0)+([b]*VAR_1)=[d],VAR_0+VAR_1=[c]	{'[d]': '840.0', '[a]': '12.0', '[b]': '4.0', '[c]': '130.0'}	[40.0,90.0]
Class A and class B donated their class fund totaling [a] dollars to an orphanage . If the amount donated by class A is [b] dollars short of [c] of the amount donated by class B . How much did Class A Donate ? How much to class B donate ?	VAR_0+VAR_1=[a],VAR_0=([c]*VAR_1)-[b]	{'[a]': '127.0', '[b]': '7.0', '[c]': '0.6667'}	[46.61607,80.3839]
A movie theater charges [a] dollars for adults and [b] dollars for children . The receipts for a showing of a movie were [c] dollars . If [d] tickets were sold , find how many adult tickets were sold . Find how many child tickets were sold .	([a]*VAR_0)+([b]*VAR_1)=[c],VAR_0+VAR_1=[d]	{'[d]': '80.0', '[a]': '7.5', '[b]': '4.5', '[c]': '540.0'}	[60.0,20.0]
A hotel purchased [a] bath towels and [b] washcloths for a total cost of [c] dollars . A second purchase of [d] bath towels and [e] washcloths , at the same prices , cost [f] dollars . Find the individual prices of the bath towels and washcloths .	([a]*VAR_0)+([b]*VAR_1)=[c],([d]*VAR_0)+([e]*VAR_1)=[f]	{'[d]': '54.0', '[a]': '38.0', '[f]': '923.0', '[e]': '50.0', '[b]': '61.0', '[c]': '791.5'}	[12.0,5.5]
To make [a] kilograms of aluminum alloy with [b] % aluminum , a scientist wants to use [c] metals with [d] % and [e] % aluminum content respectively . How many kilograms of [d] % aluminum and how many kilograms of [e] % aluminum should she mix ?	(([d]*0.01)*VAR_0)+(([e]*0.01)*VAR_1)=([a]*[b])*0.01,VAR_0+VAR_1=[a]	{'[d]': '45.0', '[a]': '10.0', '[e]': '70.0', '[b]': '60.0', '[c]': '2.0'}	[4.0,6.0]
The US Senate had a total of [a] Democrats and Republicans . There were [b] more Republicans than Democrats . How many Democrats and Republicans were there in the Senate ?	VAR_1+VAR_0=[a],VAR_1-VAR_0=[b]	{'[a]': '99.0', '[b]': '11.0'}	[44.0,55.0]
University Theater sold [a] tickets for a play . Tickets cost [b] dollars per adult and [c] dollars per senior citizen . If total receipts were [d] dollars , how many senior citizen tickets were sold ?	([b]*VAR_0)+([c]*VAR_1)=[d],VAR_0+VAR_1=[a]	{'[d]': '8748.0', '[a]': '510.0', '[b]': '21.0', '[c]': '15.0'}	[327.0]
Find two numbers whose sum is [a] if one number is [b] times as large as the other number.	VAR_0+VAR_1=[a],VAR_0=[b]*VAR_1	{'[a]': '14.0', '[b]': '3.0'}	[3.5,10.5]
Suppose you invested [a] dollars , part at [b] % annual interest and the rest at [c] % annual interest . If you received [d] dollars in interest after one year , how much did you invest at [b] % annual interest and at [c] % annual interest ?	([b]*.01*VAR_1)+([c]*.01*VAR_0)=[d],VAR_1+VAR_0=[a]	{'[d]': '684.0', '[a]': '10000.0', '[b]': '6.0', '[c]': '9.0'}	[7200.0,2800.0]
[a] less than [b] times a number equals [c] . What is the number ?	([b]*VAR_0)-[a]=[c]	{'[a]': '7.0', '[b]': '4.0', '[c]': '13.0'}	[5.0]
The Drama Club sold [a] tickets for the end-of-year-performance . Admission prices were [b] dollars for adults and [c] dollars for students . The total amount collected at the box office was [d] dollars . How many students attended the play ? How many adult attended the play ?	([c]*VAR_1)+([b]*VAR_0)=[d],VAR_1+VAR_0=[a]	{'[d]': '16200.0', '[a]': '1500.0', '[b]': '12.0', '[c]': '6.0'}	[300.0]
The sum of [a] numbers is [b] . Twice the larger number exceeds [c] times the smaller number by [d] . Find the number.	[a]*VAR_0=[d]+([c]*VAR_1),VAR_1+VAR_0=[b]	{'[d]': '16.0', '[a]': '2.0', '[b]': '43.0', '[c]': '3.0'}	[14.0,29.0]
It took me [a] minutes to walk [b] meters . How fast was I travelling ?	VAR_0=[b]/[a]	{'[a]': '6.0', '[b]': '500.0'}	[83.33]
Paul has [a] postcards . He has [b] times as many large postcards as small postcards . How many small postcards does he have ? How many large postcards ?	VAR_1+VAR_0=[a],VAR_0=[b]*VAR_1	{'[a]': '30.0', '[b]': '4.0'}	[6.0,24.0]
Marco has [a] coins , all nickels and dimes . He has [b] more dimes than nickels . How many nickels and how many dimes does he have ?	[b]+VAR_1=VAR_0,VAR_0+VAR_1=[a]	{'[a]': '150.0', '[b]': '12.0'}	[69.0,81.0]
A farmer grows only sunflowers and flax on his [a] acre farm . This year he wants to plant [b] more acres of sunflowers than flax . How many acres of sunflowers does the farmer need to plant ? How many acres of flax ?	VAR_1+VAR_0=[a],VAR_1=[b]+VAR_0	{'[a]': '240.0', '[b]': '80.0'}	[160.0,80.0]
One year Walt invested [a] dollars . He invested part of the money at [b] % and the rest at [c] % . He made a total of [d] dollars in interest . How much was invested at [b] % ?	(([b]*0.01)*VAR_1)+(([c]*0.01)*VAR_0)=[d],VAR_1+VAR_0=[a]	{'[d]': '970.0', '[a]': '12000.0', '[b]': '7.0', '[c]': '9.0'}	[5500.0]
The cost of [a] gallons of regular gasoline and [b] gallons of premium gasoline is [c] dollars . Premium costs [d] dollars more per gallon than regular . What is the cost per gallon of each type of gasoline ?	([a]*VAR_1)+([b]*VAR_0)=[c],VAR_0=[d]+VAR_1	{'[d]': '0.22', '[a]': '12.0', '[b]': '18.0', '[c]': '44.46'}	[1.35,1.57]
The world 's oldest bride was [a] yr older than her groom . Together , their ages totaled [b] years . How old was the bride ? How old was the groom ?	VAR_0+VAR_1=[b],VAR_0=[a]+VAR_1	{'[a]': '19.0', '[b]': '185.0'}	[102.0,83.0]
A catering company is setting up tables for a big event that will host [a] people . When they set up the tables they need [b] forks for each child and [c] forks for each adult . If the company ordered a total of [d] forks , how many adults and how many children will be attending the event ?	([c]*VAR_0)+([b]*VAR_1)=[d],VAR_0+VAR_1=[a]	{'[d]': '2992.0', '[a]': '764.0', '[b]': '2.0', '[c]': '5.0'}	[488.0,276.0]
In a family there are [a] cars . The sum of the average miles per gallon obtained by the two cars in a particular week is [b] . The first car has consumed [c] gallons during that week , and the second car has consumed [d] gallons , for a total of [e] miles driven by the two cars combined . What was the average gas mileage obtained by each of the [a] cars that week ?	([c]*VAR_0)+([d]*VAR_1)=[e],VAR_0+VAR_1=[b]	{'[d]': '20.0', '[a]': '2.0', '[e]': '1400.0', '[b]': '45.0', '[c]': '40.0'}	[25.0,20.0]
A bottle of wine with a cork cost [a] dollars . A bottle of wine without a cork costs [b] dollars more than the cork . What is the price of the cork ?	VAR_1+VAR_0=[a],VAR_1=[b]+VAR_0	{'[a]': '2.1', '[b]': '2.0'}	[0.05]
A piece of rope [a] meters long is cut into two pieces so that the longest piece is twice as long as the shorter piece . How long are the two pieces ?	2.0*VAR_1=VAR_0,VAR_1+VAR_0=[a]	{'[a]': '60.0'}	[20.0,40.0]
There are [a] animals on a farm , each of which is either a pig or a chicken . There are [b] legs altogether . How many pigs are there ? How many chickens ?	(4.0*VAR_1)+(2.0*VAR_0)=[b],VAR_1+VAR_0=[a]	{'[a]': '41.0', '[b]': '100.0'}	[9.0,32.0]
On a canoe trip , Rita paddled upstream at an average speed of [a] miles per hour relative to the riverbank . On the return trip downstream, her average speed was [b] miles per hour . Find Rita 's paddling speed in still water and the speed of the river 's current .	VAR_1+VAR_0=[b],VAR_1-VAR_0=[a]	{'[a]': '2.0', '[b]': '3.0'}	[2.5,0.5]
A cosmetologist has a bottle of [a] % hydrogen peroxide solution and a bottle of [b] % hydrogen peroxide solution . The cosmetologist needs [c] milliliters of a [d] % hydrogen peroxide solution . Find how many milliliters of each solution the cosmetologist needs to mix together.	(([a]*0.01)*VAR_1)+(([b]*0.01)*VAR_0)=[d]*0.01*[c],VAR_1+VAR_0=[c]	{'[d]': '5.0', '[a]': '7.0', '[b]': '4.0', '[c]': '300.0'}	[100.0,200.0]
Mitch is buying candy bars for his friends . He wants to give [a] bars to each friend , and he wants to have [b] spare bars . He can afford to buy [c] candy bars . How many friends can he treat ?	([a]*VAR_0)+[b]=[c]	{'[a]': '2.0', '[b]': '10.0', '[c]': '24.0'}	[7.0]
The total number of Democrats and Republicans in the House of Representatives was [a] . There were [b] more Republicans then Democrats . How many Democrats and Republicans were there in the Senate ?	VAR_0+VAR_1=[a],VAR_0=VAR_1-[b]	{'[a]': '434.0', '[b]': '30.0'}	[202.0,232.0]
Find a number such that [a] more than [b] the number is [c] the number.	[a]+[b]*VAR_0=[c]*VAR_0	{'[a]': '1.0', '[b]': '0.6667', '[c]': '0.75'}	[12.0]
One integer is twice another , and their sum is [a] . Find the smaller and larger integer .	2.0*VAR_1=VAR_0,VAR_1+VAR_0=[a]	{'[a]': '96.0'}	[32.0,64.0]
